pid,project_id,authors,sort_year,title,location,host,pres_date,type,url
prs_132,,"Zoss, Angela M. and Börner, Katy",2011,Mapping interactions within the evolving Science of Science and Innovation Policy community,"Durban, South Africa",13th International Society of Scientometrics and Informetrics (ISSI) conference,"July 6, 2011",Accepted presentation,
prs_133,,"Zoss, Angela M.",2011,Testing comprehension of informetric visualizations,"Durban, South Africa",Doctoral Forum of the 13th International Society of Scientometrics and Informetrics (ISSI) conference,"July 4, 2011",Accepted presentation,
prs_134,,"Zoss, Angela M.",2011,"Tools for Multivariate, Evolving Scientometric Visualizations","Paris, France",2011 Workshop on Mining the Digital Traces of Science,"March 23, 2011",Presentation,
prs_135,,"Zoss, Angela M.",2010,Information Visualization and Network Workbench: Incorporating Cyberinfrastructure into Instruction,"Durham, NC",2010 HarambeeNet Workshop on Social Networks as an Introduction to Computer Science,"July 8, 2010",Presentation,
prs_136,,"Zoss, Angela M., Conover, Michael and Börner, Katy",2010,Where are the academic jobs? Interactive exploration of job advertisements in geospatial and topical space,"Bethesda, MD","2010 International Conference on Social Computing, Behavioral Modeling, & Prediction (SBP10)","March 31, 2010",Presentation,
prs_137,,"Zoss, Angela M.",2009,Analyzing and Visualizing the Structure and Evolution of the World Wide Science,"San Sebastián, Spain",Information Kinetics: Egoviz Workshop hosted by Arteleku,"August 12, 2009",Presentation,
prs_138,,"Zoss, Angela M.",2009,Tagging Neural Network,"Bloomington, IN",Complex Adaptive Systems and Computational Intelligence Research Group,"May 13, 2009",Presentation,
prs_139,,"Zoss, Angela M.",2009,TTURC research project,"Bloomington, IN",Cyberinfrastructure for Network Science Center,"March 9, 2009",Presentation,
prs_140,,"Zoss, Angela M.",2008,arXiv.org,"Bloomington, IN",Cyberinfrastructure for Network Science Center,"September 29, 2008",Presentation,
prs_141,,"Zoss, Angela M. and Börner, Katy",2008,Mapping Transdisciplinary Tobacco Use Research Centers (TTURC) Publications onto the Landscape of the Tobacco Research Field,"Denver, Colorado",2008 Annual Conference of the American Evaluation Association,"November 8, 2008",Accepted presentation,
prs_142,,"Gay, Geri, Leshed, Gilly and Zoss, Angela M.",2006,Human-Computer Interaction,"Ithaca, NY",Cornell University,Spring 2006,Semester-long course,
prs_143,,"Boehner, Kirsten, Thom-Santelli, Jenn, Zoss, Angela M., Gay, Geri, Barrett, Tucker and Hall, Justin S.",2005,Imprints in the Museum: Social Navigation Technology for Participatory Expression,"New York City, NY",International Communication Association (ICA) 2005,"May 29, 2005",Poster Presentation,
prs_144,,"Wei, Carolyn and Zoss, Angela M.",2005,Patterns of communication and information exchange in software development,"Albuquerque, NM","Sandia National Laboratories, Student Internship Symposium 2005","August 1, 2005",Presentation,